date,platform,account,content,topic,likes,replies,reposts,quotes,engagement,url,source_type
2026-06-09,X / Twitter,@mesutkocagoztr,Bir Nefes Ver Hayatıma Projemiz kapsamında hizmet verdiğimiz Mola Evimizi ziyaret ettik.   Ailelerimizin çocuklarını güvenle emanet ettikleri Mola Evimizde atölyeler ve sosyal etkinlikler verimli zaman geçirmelerine olanak sağlıyor.   Kepez Belediyesi olarak engelsiz bir yaşam https://t.co/eY2QThe9aV,cocuk_aile,36,0,10,0,46,https://x.com/mesutkocagoztr/status/2064418281826529416,Başkan X Hesabı
2026-06-09,X / Twitter,@mesutkocagoztr,"Antalya İl Millî Eğitim Müdürlüğü tarafından Hayat Boyu Öğrenme Haftası kapsamında, Kepez Belediyemizin ev sahipliğinde düzenlenen sergiye Antalya Valimiz Sn. Hulusi Şahin ve değerli protokol ile katılım gösterdik.  Antalya Kepez Meslek Eğitim Kursları ve Halk Eğitim https://t.co/BToeC5ujCj",mill_eğitim_müdürlüğü_tarafindan,45,0,9,0,54,https://x.com/mesutkocagoztr/status/2064393680266424458,Başkan X Hesabı
2026-06-09,X / Twitter,@mesutkocagoztr,"Henüz yolun başındaydı… Kalbinde öğretme sevdası, gözlerinde öğrencilerine kavuşmanın heyecanı vardı Aybüke Öğretmen’in.  Hain saldırıda yaralanarak şehit düştüğünde henüz 22 yaşındaydı. Umutları, hayalleri ve güzel ismi bugün de yüreklerimizde yaşamaya devam ediyor. https://t.co/ESbX5gdqnT",hizmet_asfalt,53,1,9,0,63,https://x.com/mesutkocagoztr/status/2064350248709783567,Başkan X Hesabı
2026-06-09,X / Twitter,@mesutkocagoztr,"Kepez Belediyesi Başpehlivanımız Ali Gürbüz ile pehlivanlarımız Rıza Durmuş ve İlker Durmuş’u belediyemizde ağırladık.  Kepez’imizi er meydanlarında gururla temsil eden pehlivanlarımıza nazik ziyaretleri için teşekkür ediyor, başarılarının devamını diliyoruz. https://t.co/otdtlssEDC",başpehlivanimiz_gürbüz_pehlivanlarimiz_riza,57,0,14,0,71,https://x.com/mesutkocagoztr/status/2064339009581510865,Başkan X Hesabı
2026-06-09,X / Twitter,@mesutkocagoztr,"Nasreddin Hoca Kreş ve Gündüz Bakımevlerimizin Özgürlük, Sakarya, Teomanpaşa ve Ahatlı şubelerinde eğitimlerini tamamlayan 5 yaş grubu çocuklarımızı ilkokul yolculuğuna uğurladık.   Erdem Bayazıt Kültür Merkezi’nde düzenlenen törenlerde, miniklerimizin mezuniyet heyecanını https://t.co/m6nBwu9nHX",hizmet_asfalt,64,1,21,1,87,https://x.com/mesutkocagoztr/status/2064325127915905299,Başkan X Hesabı
2026-06-09,X / Twitter,@mesutkocagoztr,"2026 FIFA Dünya Kupası heyecanını hep birlikte yaşıyoruz! 🇹🇷  A Milli Takımımızın Avustralya karşısındaki mücadelesini, Dokumapark’ta kurulacak dev ekranda hemşehrilerimizle birlikte takip ediyoruz.  📅 14 Haziran 2026 📍 Dokumapark 🕖 07.00  Dünya Kupası coşkusuna ortak olmak, https://t.co/r7EMOCeuod",2026_fifa_dünya_kupasi,51,0,18,0,69,https://x.com/mesutkocagoztr/status/2064298117713871219,Başkan X Hesabı
2026-06-09,X / Twitter,@mesutkocagoztr,"Bir yıl önce ebediyete uğurladığımız Manisa Büyükşehir Belediye Başkanımız, kıymetli kardeşimiz Ferdi Zeyrek’i rahmet, özlem ve saygıyla anıyorum.  Halkıyla kurduğu güçlü bağ ve Manisa’ya duyduğu sevda ile hemşehrilerinin gönlünde özel bir yer edinen Ferdi Başkan, bıraktığı güzel https://t.co/HxUwLovx8T",buyuksehir_ulasim,59,4,18,0,81,https://x.com/mesutkocagoztr/status/2064252737269715431,Başkan X Hesabı
2026-06-08,X / Twitter,@mesutkocagoztr,"Kepez’imizde hemşehrilerimizle aramızdaki bağların gücü, en özel anlarda bir arada olmamızdan geliyor.   Bu düşünce ile açtığımız ve yapımına devam ettiğimiz semt evlerimize bir yenisini daha eklemek için hayırsever Murat Bahadır ile protokol imzaladık. Bu protokol ile Kuzeyyaka https://t.co/SZdTxQQdz8",imizde_hemşehrilerimizle_aramizdaki_bağlarin,77,1,19,0,97,https://x.com/mesutkocagoztr/status/2064071951514206525,Başkan X Hesabı
2026-06-08,X / Twitter,@mesutkocagoztr,"Antalya’nın Geleceği Kepez’de 7 Gün Nasıl Geçti? 🔎  📌 35 noktada, 7 gün 24 saat süren fotokapan denetimleriyle çevreyi kirletenlere geçit verilmedi. 📌 Başkan Mesut Kocagöz, Kent Market’te incelemelerde bulunarak çalışmalar hakkında bilgi aldı. 📌 Başkan Mesut Kocagöz, Şehit https://t.co/2WKFKvrkjb",geleceği_nasil_geçti_noktada,82,0,29,0,111,https://x.com/mesutkocagoztr/status/2064031428103336225,Başkan X Hesabı
