date,platform,account,content,topic,likes,replies,reposts,quotes,engagement,url,source_type
2026-06-25,X / Twitter,@mesutkocagoztr,"Kepez’imizde temiz bir geleceğin temellerini atıyor, örnek bir farkındalık hareketi başlatıyoruz.  “Temizlik Kirletmemektir” projemizle ilçemizin dört bir yanında temizlik, bakım, onarım ve bilinçlendirme çalışmalarımızı sürdürüyor; kent bilincini hep birlikte büyütüyoruz. https://t.co/rNNfn3peIl",imizde_temiz_geleceğin_temellerini,45,3,10,0,58,https://x.com/mesutkocagoztr/status/2070068967473897601,Başkan X Hesabı
2026-06-25,X / Twitter,@mesutkocagoztr,"Paylaşmanın bereketini, birlik ve beraberliğimizin gücünü sofralarımızda buluşturan Aşure Günü’nün manevi iklimini hep birlikte yaşıyoruz.  Dayanışmanın, kardeşliğin ve paylaşmanın simgesi olan Aşure Günü’nün hayırlara vesile olmasını diliyor, Muharrem Ayı’nın sağlık, huzur ve https://t.co/attHqbd3Cc",paylaşmanin_bereketini_birlik_beraberliğimizin,31,0,5,0,36,https://x.com/mesutkocagoztr/status/2070059931244302807,Başkan X Hesabı
2026-06-24,X / Twitter,@mesutkocagoztr,"Şehit Özcan Şenol Mesleki ve Teknik Anadolu Lisesi Mezuniyet Töreni’nde gençlerimizin heyecanını paylaştık.   Evlatlarımızın, üniversite yolunda hayallerini süsleyen bölümleri kazanmalarını, Gazi Mustafa Kemal Atatürk’ün işaret ettiği çağdaş Türkiye yolunda ilerlemelerini temenni https://t.co/sZLwLnQy0T",hizmet_asfalt,50,0,8,0,58,https://x.com/mesutkocagoztr/status/2069870052921213140,Başkan X Hesabı
2026-06-24,X / Twitter,@mesutkocagoztr,TSD ve Aktif Engelliler Yönetim Kurulu ve Milli Sporcularımızı belediyemizde ağırladık.   ​Kepez Belediyesi olarak destek verdiğimiz Erişilebilir Antalya 19/19 projesi üzerine konuştuk.  ​ Ziyaretimize gelen Türkiye Sakatlar Derneği Antalya Şube Başkanı &amp; Aktif Engelliler Spor https://t.co/yhDCCKes8f,spor_etkinlik,34,0,4,0,38,https://x.com/mesutkocagoztr/status/2069866880370954304,Başkan X Hesabı
2026-06-24,X / Twitter,@mesutkocagoztr,"Ferit Özer’in faaliyete giren işletmesinin açılışını gerçekleştirdik.  Hayırlı işler, bol kazançlar diliyorum. https://t.co/4BBIbQ3jgo",ferit_özer_faaliyete_giren,43,0,6,0,49,https://x.com/mesutkocagoztr/status/2069865398640464081,Başkan X Hesabı
2026-06-24,X / Twitter,@mesutkocagoztr,Erenköy Mahallemizde altyapısı tamamlanan noktalarda yürüttüğümüz sıcak asfalt çalışmalarını yerinde inceledik.  Yıllardır açılmayı bekleyen bu yolun tamamlanmasıyla hem mahalle ulaşımı rahatlayacak hem de bölge esnafımızın işleri canlanacak.  Hemşehrilerimizin emanetine sahip https://t.co/vwa62yQLPU,hizmet_asfalt,66,0,17,0,83,https://x.com/mesutkocagoztr/status/2069835317616799772,Başkan X Hesabı
2026-06-24,X / Twitter,@mesutkocagoztr,"Çamlıbel Mahalle Muhtarımız Ramazan Çatal, Erenköy Mahalle Muhtarımız Ömer Akgün ve Esentepe Mahalle Muhtarımız Bekir Yılmaz bizleri ziyaret etti.   Mahallelerimizdeki çalışma arkadaşlarımız Muhtarlarımızla kentimizin geleceği için istişare halinde çalışıyoruz. Görüşleri ve https://t.co/DAujDYlqgH",çamlibel_mahalle_muhtarimiz_ramazan,49,0,6,0,55,https://x.com/mesutkocagoztr/status/2069805477169389660,Başkan X Hesabı
2026-06-24,X / Twitter,@mesutkocagoztr,"Antalya Şehir Hastanemizin karşısında, hemşehrilerimize nefes aldıracak yeni bir yaşam alanını Kepez’imize kazandırıyoruz.  Bu projeyle; hasta ve hasta yakınlarımızın daha konforlu koşullarda dinlenebileceği, temel ihtiyaçlarını karşılayabileceği bir alan oluşturuyoruz.  Bölge https://t.co/uDGAUBzCEL",şehir_hastanemizin_karşisinda_hemşehrilerimize,80,1,17,0,98,https://x.com/mesutkocagoztr/status/2069703399776391235,Başkan X Hesabı
2026-06-23,X / Twitter,@mesutkocagoztr,"Dayanışma Buluşmalarımız kapsamında Odabaşı Mahallemizde düzenlediğimiz Yaz Şenliği’nde hemşehrilerimizle bir araya geldik.  Sağlık Tırımızdan Bilim ve Teknoloji Tırımıza, Mini Rota Mobil Kreşimizden kuaför hizmetimize kadar belediyemizin birçok hizmetini hemşehrilerimizle https://t.co/dNDSsUqCrr",dayanişma_buluşmalarimiz_kapsaminda_odabaşi,76,1,20,0,97,https://x.com/mesutkocagoztr/status/2069469584894144537,Başkan X Hesabı
