date,platform,account,content,topic,likes,replies,reposts,quotes,engagement,url,source_type
2026-06-01,X / Twitter,@mesutkocagoztr,"Gök vatanımızın güvenliği için cesaret, disiplin ve üstün görev bilinciyle hizmet eden Türk Hava Kuvvetlerimizin kahraman askerleri her zaman kıvanç kaynağımız oldu.   Gazi Mustafa Kemal Atatürk'ün ""İstikbal göklerdedir"" sözünü kendisine yol haritası yapan, Ay yıldızlı https://t.co/Yn9WLJDRnB",hizmet_asfalt,3,0,0,0,3,https://x.com/mesutkocagoztr/status/2061389730973986820,Başkan X Hesabı
2026-05-31,X / Twitter,@mesutkocagoztr,Ayşe Beyza kızımız ile Ahmet oğlumuzun nikah akitlerini gerçekleştirdik.   Genç çiftimize ömür boyu mutluluklar diliyorum. https://t.co/HikSurvdyO,ayşe_beyza_kizimiz_ahmet,43,0,2,0,45,https://x.com/mesutkocagoztr/status/2061172888351265282,Başkan X Hesabı
2026-05-31,X / Twitter,@mesutkocagoztr,Kepez Belediyesi Başpehlivanımız Ali Gürbüz’ün Antalya - Kemer yolunda trafik kazası geçirdiğini öğrendim.  Kazayı yara almadan atlatan başpehlivanımıza geçmiş olsun dileklerimi iletiyorum. Allah beterinden korusun.,hizmet_asfalt,44,0,7,0,51,https://x.com/mesutkocagoztr/status/2061115542363111770,Başkan X Hesabı
2026-05-31,X / Twitter,@mesutkocagoztr,"Denizli’de meydana gelen, biri bebek, 8 vatandaşımızın hayatını kaybettiği, 33 vatandaşımızın yaralandığı kazadan dolayı çok üzgünüm.   Kazada hayatını kaybeden vatandaşlarımıza Allah’tan rahmet, ailelerine başsağlığı, yaralılarımıza acil şifalar diliyorum.",denizli_meydana_gelen_biri,48,1,5,0,54,https://x.com/mesutkocagoztr/status/2061002581980098693,Başkan X Hesabı
2026-05-29,X / Twitter,@mesutkocagoztr,"350. Kabulbaba Yağlı Güreşleri’nde Altın Kemer Kepez Belediyesi Pehlivanımız Ali Gürbüz’ün oldu.   Güreşin Mega Starı Ali Gürbüz’ü kutluyor, er meydanındaki başarılarının devamını diliyorum. https://t.co/kJkgtEPeHN",kabulbaba_yağli_güreşleri_altin,68,0,11,0,79,https://x.com/mesutkocagoztr/status/2060452495739003177,Başkan X Hesabı
2026-05-29,X / Twitter,@mesutkocagoztr,"Çocuklarımızın gün içinde güvende olduğunu bilmek, sevildiğini hissetmek ve her gün yeni bir şey öğrenerek büyüdüğünü görmek aileler için çok kıymetli.  Kreşlerimizde biz de çocuklarımızı yalnızca eğitimle değil; sevgiyle, ilgiyle ve özenle karşılıyoruz. https://t.co/b18S4i9DNQ",cocuk_aile,78,1,18,0,97,https://x.com/mesutkocagoztr/status/2060434689014321545,Başkan X Hesabı
2026-05-28,X / Twitter,@mesutkocagoztr,"Çankaya Mahallemizde hemşehrilerimize verdiğimiz sözü yerine getirmek için çalışmalarımıza başladık.  Altyapı problemleri giderilen mahallemizde, üstyapı çalışmaları kapsamında yaklaşık 5 bin metrekarelik alanda asfalt çalışması gerçekleştiriyoruz. https://t.co/UpCF2NdbkW",hizmet_asfalt,113,4,24,0,141,https://x.com/mesutkocagoztr/status/2060029555134627965,Başkan X Hesabı
2026-05-28,X / Twitter,@mesutkocagoztr,"Can Azerbaycan’ın bağımsızlık mücadelesi; ortak tarihimizin, kardeşliğimizin ve “tek millet, iki devlet” anlayışımızın en güçlü sembollerinden biridir.  Türkiye ve Azerbaycan arasındaki gönül bağı, dün olduğu gibi bugün de dayanışmayla, sevgiyle ve ortak değerlerle güçlenmeye https://t.co/pJfpNcSxmb",azerbaycan_bağimsizlik_mücadelesi_ortak,75,4,13,0,92,https://x.com/mesutkocagoztr/status/2059893267995484549,Başkan X Hesabı
2026-05-27,X / Twitter,@mesutkocagoztr,Kepez Devlet Hastanesi’nde bayramı tedavi altında geçiren hastalarımızın ve büyük bir fedakarlıkla görevi başında olan sağlık çalışanlarımızın bayramını kutladık.   Tüm hastalarımıza acil şifalar diliyorum. Bayramlarını sağlık ve huzur temennilerimle kutluyorum. https://t.co/RJQsjjC0zp,devlet_hastanesi_bayrami_tedavi,87,0,11,1,99,https://x.com/mesutkocagoztr/status/2059554771954975209,Başkan X Hesabı
