date,platform,account,content,topic,likes,replies,reposts,quotes,engagement,url,source_type
2026-05-02,X / Twitter,@mesutkocagoztr,Sibel ve Abdullah ile Seren ve Hakan evlatlarımızın nikah akitlerini gerçekleştirdik.   Genç çiftlerimize ömür boyu mutluluklar diliyorum. https://t.co/cyoMXTFDBB,sibel_abdullah_seren_hakan,45,0,6,0,51,https://x.com/mesutkocagoztr/status/2050673524801405119,Başkan X Hesabı
2026-05-01,X / Twitter,@mesutkocagoztr,"Öğrenci Kent Lokantamızda hazırlanan ev yemekleri; hem bütçeyi zorlamayan fiyatıyla hem de anne yemeğini hatırlatan lezzetiyle gençlerimizden her yeni günde tam not alıyor. Doyurucu menüler, güvenilir yemekler ve sıcak bir sofra anlayışıyla öğrencilerimizin günlük yaşamına destek https://t.co/Sl0or22XKL",öğrenci_kent_lokantamizda_hazirlanan,147,2,39,0,188,https://x.com/mesutkocagoztr/status/2050306481921085531,Başkan X Hesabı
2026-05-01,X / Twitter,@mesutkocagoztr,"Emek; alın teriyle büyüyen, yarınları yeşerten bir filizdir. Bir toplumun asıl zenginliği işleyen ellerin azminde saklıdır.  Emeğin en yüce değer olduğunun bilinciyle; kentimizin her mahallesinde, her sokağında emek veren kardeşlerimizin izi var.   Toprağa can verenlere, üretime https://t.co/9H3rK5yW20",emek_alin_teriyle_büyüyen,82,0,20,0,102,https://x.com/mesutkocagoztr/status/2050090650805080496,Başkan X Hesabı
2026-04-30,X / Twitter,@mesutkocagoztr,"Kepez’imizde herkes için erişilebilir, güvenli ve kapsayıcı yaşam alanları oluşturmaya devam ediyoruz.  Sütçüler ve Gaziler Mahallelerimiz sınırları içerisinde yer alan 4 bin metrekarelik alanda, özel bireylerimizin ihtiyaçlarına uygun şekilde hazırlanan bir park hayata https://t.co/OZMgcFYpdx",imizde_herkes_erişilebilir_güvenli,95,1,24,0,120,https://x.com/mesutkocagoztr/status/2049916193960812945,Başkan X Hesabı
2026-04-29,X / Twitter,@mesutkocagoztr,"Yeni Emek ve Kütükçü Mahallelerimizde esnaflarımızı ziyaret ettik.   Hayırlı işler dilediğimiz esnaflarımızın bizden taleplerini dinleyip çözüm önerilerini konuştuk.   Mahallelerimizin bel kemiği esnaflarımızın her zaman yanındayız. Onların yüzlerinin gülmesi, bizim mutluluğumuz. https://t.co/Tggwurhwaz",emek_kütükçü_mahallelerimizde_esnaflarimizi,99,0,23,0,122,https://x.com/mesutkocagoztr/status/2049472278438519044,Başkan X Hesabı
2026-04-28,X / Twitter,@mesutkocagoztr,"Varsak Yeni Camii'de hacı adayları ile bir araya gelip Kur'an tilavetine katıldık, hemşehrilerimize lokma ikramında bulunduk.   Hacı adaylarımızın kutsal vazifelerinin ve ettiğimiz duaların Rabbimizin katında kabul olmasını temenni ediyorum. https://t.co/9qFzxqwW6A",varsak_camii_haci_adaylari,110,0,20,0,130,https://x.com/mesutkocagoztr/status/2049177587927097543,Başkan X Hesabı
2026-04-27,X / Twitter,@mesutkocagoztr,"Bu bayrakta binlerce Mehmetçik'in kanı var, Anadolu insanının duası var.  Gururla taşıdığımız bayrağımızın çöpte olması kabul edebileceğimiz bir durum değildir. Çalışma arkadaşımız Serhat Acar da bu hassasiyeti gösteren vatansever bir kardeşimiz.   Mesai sırasında bir çöp https://t.co/5Ys61bDk1z",bayrak_personel,188,2,47,0,237,https://x.com/mesutkocagoztr/status/2048835999095259254,Başkan X Hesabı
2026-04-27,X / Twitter,@mesutkocagoztr,"23 Nisan Ulusal Egemenlik ve Çocuk Bayramı’nı Kepez’de günler boyunca süren etkinliklerle coşku içinde kutladık.  Şehrin dört bir yanına yayılan programlarda; çocuklarımızın neşesi, enerjisi ve hayalleri her anın merkezindeydi. Sahnedeki alkışlardan atölyelerdeki meraka, spor https://t.co/y9HlJGWFNB",cocuk_aile,94,0,26,0,120,https://x.com/mesutkocagoztr/status/2048828837207625820,Başkan X Hesabı
2026-04-27,X / Twitter,@mesutkocagoztr,Antalya’nın Geleceği Kepez’de 7 gün nasıl geçti? 🔎  📌 23 Nisan coşkusu tüm kente yayıldı. 📌 Otizm Parkı’nda çalışmalar hızlandı. 📌 Şelale–Ayanoğlu Köprüsü hizmete açıldı. 📌 Antalya Bilim Merkezi’nde eğitim buluşması. 📌 Baraj Mahallesi’nde gönül hizmeti. 📌 Kepez Drag Pisti https://t.co/oPni6gNLo9,cocuk_aile,101,1,26,1,129,https://x.com/mesutkocagoztr/status/2048810014089916772,Başkan X Hesabı
