date,platform,account,content,topic,likes,replies,reposts,quotes,engagement,url,source_type
2026-05-13,X / Twitter,@mesutkocagoztr,"Bu yıl ilk kez düzenlenen Ulusal Erişilebilirlik Günü kapsamında gerçekleştirilen Engelli, Aile, Toplum, Gençlik ve Spor Festivali AntFest’e katıldık.  Antalya Valimiz Sayın Hulusi Şahin ve ilçe belediye başkanlarımızla birlikte yer aldığımız etkinlikte, Kepez Belediyesi https://t.co/7RSXJZBkzR",spor_etkinlik,11,0,3,0,14,https://x.com/mesutkocagoztr/status/2054555173041635765,Başkan X Hesabı
2026-05-13,X / Twitter,@mesutkocagoztr,"12 yıl önce Soma’da yaşanan maden faciasında 301 madencimizi kaybettik…  Geride tarifsiz acılar, dinmeyen özlemler ve hafızalarımızdan silinmeyen bir yara kaldı. Soma’da yaşanan acı, sadece ailelerin değil, tüm ülkemizin ortak vicdanında derin izler bıraktı.  Soma Maden https://t.co/VQUMoJxeAx",teleferik_davasi,26,0,9,0,35,https://x.com/mesutkocagoztr/status/2054463350117904497,Başkan X Hesabı
2026-05-12,X / Twitter,@mesutkocagoztr,"Meclis Üyemiz Rüştü Peker'in kaybettiği ablası Havana Dönmez için taziye ziyaretinde bulunduk.   Merhumeye Allah'tan rahmet, Peker ailesine ve sevenlerine başsağlığı diliyorum. Mekanı cennet olsun. https://t.co/9aiP6bMpfJ",meclis_üyemiz_rüştü_peker,56,1,5,0,62,https://x.com/mesutkocagoztr/status/2054285882975199330,Başkan X Hesabı
2026-05-12,X / Twitter,@mesutkocagoztr,"Romanya'nın farklı şehirlerinden gelen kütüphanecileri belediyemiz ve Antalya Kütüphanemizde ağırladık.   Ziyaretçilerimiz, kütüphanemizin 24 saat hizmet sistemi, rezervasyon uygulaması ve dijital kütüphanecilik gibi birçok çalışmasını yerinde inceledi.   Belediyemizi de ziyaret https://t.co/lKQgmMxRhe",romanya_farkli_şehirlerinden_gelen,55,0,8,0,63,https://x.com/mesutkocagoztr/status/2054266232405451023,Başkan X Hesabı
2026-05-12,X / Twitter,@mesutkocagoztr,"Antalya Valiliği himayelerinde gerçekleştirilen Antalya Mavi Akdeniz İnisiyatifi tanıtım programına katıldık.   Sıfır Atık vizyonunu destekliyor, bizler de kentimizin sahil şeridi ve deniz ekosisteminin korunması gerekliliğini yineliyoruz.   Bu hassasiyeti gösteren ve projeyi https://t.co/JKvq16QZuK",valiliği_himayelerinde_gerçekleştirilen_mavi,60,2,9,0,71,https://x.com/mesutkocagoztr/status/2054259461661888888,Başkan X Hesabı
2026-05-12,X / Twitter,@mesutkocagoztr,"Kepez Enfes 2026 Engelsiz Festival’de, Dokumapark’ta sevginin, neşenin ve birlikteliğin en güzel halini yaşadık.   Kepez’imizde ilk kez düzenlediğimiz bu özel festivalde; engelli bireylerimiz, aileleri ve hemşehrilerimiz müzik, sahne gösterileri, atölyeler ve renkli etkinliklerle https://t.co/pEdnfWig5T",enfes_2026_engelsiz_festival,72,0,22,1,95,https://x.com/mesutkocagoztr/status/2054254511309672787,Başkan X Hesabı
2026-05-12,X / Twitter,@mesutkocagoztr,"Yeni mezunların iş hayatına ilk adımına, deneyimli adayların ise yeni kariyer yolculuklarına destek olmak için düzenlediğimiz Kepez Belediyesi Kariyer ve İstihdam Günü yoğun ilgiyle gerçekleşti.  Organize Sanayi Bölgesi ve Serbest Bölge’de faaliyet gösteren öncü firmaları https://t.co/3e5suqY0Ib",hizmet_asfalt,70,1,16,0,87,https://x.com/mesutkocagoztr/status/2054225061477802018,Başkan X Hesabı
