date,platform,account,content,topic,sentiment,risk_score,opportunity_score,likes,comments,shares,views,url,action_note,source_type,local_relevance_score,local_relevance_level,local_relevance_reason,president_decision_candidate,control_decision
2026-06-20,X / Twitter,@Antalya_haberim,"Antalya'da kamu personeli ormanı bölüştü: Mahkeme 'dur' dedi!  Antalya Valiliği'ne bağlı Yatırım İzleme ve Koordinasyon Başkanlığı (YİKOB) ve Büyükşehir Belediyesi'nde görev yapan bazı kamu personelinin, Kepez ilçesindeki toplam 45 bin 191 metrekarelik orman arazisini kendi https://t.co/APgWWB39HO",Kepez,neutral,4,2,1,0,0,0,https://x.com/Antalya_haberim/status/2068258938752000019,İçerik izlemeye alınmalı. Şu aşamada acil aksiyon gerekmiyor.,Otomatik X,9,Yüksek,Kepez sinyali • Antalya + Kepez birlikte • Başkan / belediye bağlamı • hizmet / şikayet / kriz bağlamı,Evet,Başkan karar aday
2026-06-20,X / Twitter,@AntalyaHakkinda,"Antalya'da kamu personeli ormanı bölüştü: Mahkeme 'dur' dedi!  Antalya Valiliği'ne bağlı Yatırım İzleme ve Koordinasyon Başkanlığı (YİKOB) ve Büyükşehir Belediyesi'nde görev yapan bazı kamu personelinin, Kepez ilçesindeki toplam 45 bin 191 metrekarelik orman arazisini kendi",Kepez,neutral,4,2,44,7,12,0,https://x.com/AntalyaHakkinda/status/2068249265088950659,İçerik izlemeye alınmalı. Şu aşamada acil aksiyon gerekmiyor.,Otomatik X,9,Yüksek,Kepez sinyali • Antalya + Kepez birlikte • Başkan / belediye bağlamı • hizmet / şikayet / kriz bağlamı,Evet,Başkan karar aday
2026-06-19,X / Twitter,@sehrimantalya,KEPEZ'DEN TEMİZLİKTE ORTAK SORUMLULUK ÇAĞRISI Kepez Belediyesi'nin başlattığı “Temizlik Kirletmemektir” kampanyasıyla çevre temizliğinde farkındalık artırılıyor.  https://t.co/jxvW29j06J,Kepez Belediyesi + temizlik,neutral,4,2,0,0,0,0,https://x.com/sehrimantalya/status/2068005138187301213,İçerik izlemeye alınmalı. Şu aşamada acil aksiyon gerekmiyor.,Otomatik X,10,Yüksek,Kepez Belediyesi / Kepez Belediye Başkanı sinyali • Antalya sinyali • Başkan / belediye bağlamı • genel/zayıf mahalle sinyali • hizmet / şikayet / kriz bağlamı,Evet,Başkan karar aday
2026-06-19,X / Twitter,@Hsynant7,@kepezbelediyesi Senelerdir Kepez WhatsApp hattına sikayette bulundum Kepez belediyesine gidip sikayet dilekçesi verdim hala bi sonuç yok parkın bakımı yapılıyor sulaması yapılıyor arabalar parkın içine girip park yapıyor kamu malına zarar veriliyor ve buna göz yumuluyor https://t.co/zD6qp6OsZC,Kepez Belediyesi + sikayet,neutral,4,4,0,1,0,0,https://x.com/Hsynant7/status/2067872956135452735,İçerik izlemeye alınmalı. Şu aşamada acil aksiyon gerekmiyor.,Otomatik X,8,Yüksek,Kepez Belediyesi / Kepez Belediye Başkanı sinyali • Başkan / belediye bağlamı • hizmet / şikayet / kriz bağlamı,Evet,Başkan karar aday
2026-06-19,X / Twitter,@Hsynant7,@kepezbelediyesi Senelerdir Kepez WhatsApp hattına sikayette bulundum Kepez belediyesine gidip sikayet dilekçesi verdim hala bi sonuç yok parkın bakımı yapılıyor sulaması yapılıyor arabalar parkın içine girip park yapıyor https://t.co/M4FtPO2snR,Kepez Belediyesi + sikayet,neutral,4,4,0,1,0,0,https://x.com/Hsynant7/status/2067872562701377847,İçerik izlemeye alınmalı. Şu aşamada acil aksiyon gerekmiyor.,Otomatik X,8,Yüksek,Kepez Belediyesi / Kepez Belediye Başkanı sinyali • Başkan / belediye bağlamı • hizmet / şikayet / kriz bağlamı,Evet,Başkan karar aday
