date,platform,account,content,topic,sentiment,risk_score,opportunity_score,likes,comments,shares,views,url,action_note,source_type,local_relevance_score,local_relevance_level,local_relevance_reason,president_decision_candidate,control_decision
2026-06-12,X / Twitter,@mesutkocagoztr,Kepez’imizde Sathi Asfalt Sezonunu başlattık.   2026 sezonunu Milletvekilimiz ve PM Üyemiz Cavit Arı ve Kepez İlçe Başkanı’mız Gökhan Ölmez’in katılımı ile açtık.   Çalışma ile bu sezon toplam 80 km sathi kaplama yapmış olacağız. Altyapı yatırımlarımızla eş zamanlı yürüttüğümüz https://t.co/oWULRNv0Aa,Kepez + asfalt,neutral,4,2,22,0,8,0,https://x.com/mesutkocagoztr/status/2065422260161204687,İçerik izlemeye alınmalı. Şu aşamada acil aksiyon gerekmiyor.,Otomatik X,10,Yüksek,Mesut Kocagöz sinyali • Kepez sinyali • Başkan / belediye bağlamı • hizmet / şikayet / kriz bağlamı,Evet,Başkan karar aday
2026-06-12,X / Twitter,@Mv_CavitAri,"Kepez Belediyesi tarafından düzenlenen Sati Kaplama Asfalt Sezonu başlangıç törenine katıldık.Bütün Belediyelerimize çalışmalarında başarılar diliyorum. Emekçi kardeşlerimize sağlıkla, kazasız sorunsuz çalışmalar dilerim. https://t.co/JH64Fg7nC7",Kepez Belediyesi + asfalt,negative,8,2,12,6,0,0,https://x.com/Mv_CavitAri/status/2065385110476661197,"X üzerinde riskli paylaşım tespit edildi. Yayılım, yorum tonu ve yerel basına sıçrama ihtimali izlenmeli.",Otomatik X,9,Yüksek,Kepez Belediyesi / Kepez Belediye Başkanı sinyali • Başkan / belediye bağlamı • genel/zayıf mahalle sinyali • hizmet / şikayet / kriz bağlamı,Evet,Başkan karar aday
2026-06-11,X / Twitter,@mesutkocagoztr,"Kepez’de ulaşım konforunu artırmak, yollarımızı daha güvenli ve düzenli hale getirmek amacıyla 2026 yılı sathi asfalt sezonumuzu başlatıyoruz.  Kepez Belediyesi 2026 Sathi Asfalt Sezonu Açılış Töreni’ne tüm hemşehrilerimizi davet ediyoruz.  📍 Altınova Düden Mahallesi Er Sokak 📅 https://t.co/iyMOMC1l6x",Kepez Belediyesi + asfalt,neutral,4,2,61,0,10,0,https://x.com/mesutkocagoztr/status/2064992775754387539,İçerik izlemeye alınmalı. Şu aşamada acil aksiyon gerekmiyor.,Otomatik X,10,Yüksek,Mesut Kocagöz sinyali • Kepez Belediyesi / Kepez Belediye Başkanı sinyali • Başkan / belediye bağlamı • güçlü Kepez mahalle sinyali • hizmet / şikayet / kriz bağlamı,Evet,Başkan karar aday
2026-06-11,X / Twitter,@AntalyaBurada,"YENİ YOLA BAŞLANDI! Kepez Belediyesi, Fevzi Çakmak ve Çankaya mahallelerini birbirine bağlayacak yeni cadde çalışmasını başlattı. 20 m. genişliğinde, bin 100 m. uzunluğundaki yol, Varsak Gaziler-Şehir Hastanesi, Organize Sanayi ve Batı Çevre Yolu’na kesintisiz ulaşım sağlayacak. https://t.co/7AGO1dK5vJ",Kepez Belediyesi + ulaşım,neutral,2,2,1,0,0,0,https://x.com/AntalyaBurada/status/2064948631036117185,İçerik izlemeye alınmalı. Şu aşamada acil aksiyon gerekmiyor.,Otomatik X,7,Orta,Kepez Belediyesi / Kepez Belediye Başkanı sinyali • Antalya sinyali • Başkan / belediye bağlamı • güçlü Kepez mahalle sinyali • hizmet / şikayet / kriz bağlamı • alakasız ilan / emlak / spor / iş ilanı sinyali,Hayır,Ekip kontrolü
2026-06-10,X / Twitter,@kepezbelediyesi,"Kepez’de ulaşım konforunu artırmak, yollarımızı daha güvenli ve düzenli hale getirmek amacıyla 2026 yılı sathi asfalt sezonumuzu başlatıyoruz.  Kepez Belediyesi 2026 Sathi Asfalt Sezonu Açılış Töreni’ne tüm hemşehrilerimizi davet ediyoruz.  📍 Altınova Düden Mahallesi Er Sokak 📅 https://t.co/lu7GN0fKXm",Kepez Belediyesi + asfalt,neutral,4,2,21,1,2,0,https://x.com/kepezbelediyesi/status/2064701186574344322,İçerik izlemeye alınmalı. Şu aşamada acil aksiyon gerekmiyor.,Otomatik X,10,Yüksek,Kepez Belediyesi / Kepez Belediye Başkanı sinyali • Başkan / belediye bağlamı • güçlü Kepez mahalle sinyali • hizmet / şikayet / kriz bağlamı,Evet,Başkan karar aday
2026-06-10,X / Twitter,@kepezbelediyesi,"@d7bayram @ANTALYABB @abbiletisim @mesutkocagoztr @Antalya07_ @AntalyaHakkinda Merhabalar Bayram Bey,  Talebiniz kapsamında gerekli inceleme ve kontroller gerçekleştirilmiştir. İbrahim Gündoğdu Parkı'ndaki sulama sisteminin kontrol edilmesi hususu, değerlendirilmek ve gerekli işlemlerin tesis edilmesi amacıyla ilgili birimimiz olan Park ve Bahçeler",park,neutral,4,4,5,1,0,0,https://x.com/kepezbelediyesi/status/2064594276818829572,İçerik izlemeye alınmalı. Şu aşamada acil aksiyon gerekmiyor.,Otomatik X,10,Yüksek,Mesut Kocagöz sinyali • Kepez sinyali • Antalya sinyali • Başkan / belediye bağlamı • genel/zayıf mahalle sinyali • hizmet / şikayet / kriz bağlamı,Evet,Başkan karar aday
2026-06-08,X / Twitter,@mesutkocagoztr,"Antalya’nın Geleceği Kepez’de 7 Gün Nasıl Geçti? 🔎  📌 35 noktada, 7 gün 24 saat süren fotokapan denetimleriyle çevreyi kirletenlere geçit verilmedi. 📌 Başkan Mesut Kocagöz, Kent Market’te incelemelerde bulunarak çalışmalar hakkında bilgi aldı. 📌 Başkan Mesut Kocagöz, Şehit https://t.co/2WKFKvrkjb",Mesut Kocagöz,neutral,4,2,102,0,31,0,https://x.com/mesutkocagoztr/status/2064031428103336225,İçerik izlemeye alınmalı. Şu aşamada acil aksiyon gerekmiyor.,Otomatik X,10,Yüksek,Mesut Kocagöz sinyali • Kepez sinyali • Antalya sinyali • Başkan / belediye bağlamı • hizmet / şikayet / kriz bağlamı,Evet,Başkan karar aday
