date,platform,account,content,topic,sentiment,risk_score,opportunity_score,likes,comments,shares,views,url,action_note,source_type,local_relevance_score,local_relevance_level,local_relevance_reason,president_decision_candidate,control_decision
2026-06-19,X / Twitter,@sehrimantalya,KEPEZ'DEN TEMİZLİKTE ORTAK SORUMLULUK ÇAĞRISI Kepez Belediyesi'nin başlattığı “Temizlik Kirletmemektir” kampanyasıyla çevre temizliğinde farkındalık artırılıyor.  https://t.co/jxvW29j06J,Kepez Belediyesi + temizlik,neutral,4,2,0,0,0,0,https://x.com/sehrimantalya/status/2068005138187301213,İçerik izlemeye alınmalı. Şu aşamada acil aksiyon gerekmiyor.,Otomatik X,10,Yüksek,Kepez Belediyesi / Kepez Belediye Başkanı sinyali • Antalya sinyali • Başkan / belediye bağlamı • genel/zayıf mahalle sinyali • hizmet / şikayet / kriz bağlamı,Evet,Başkan karar aday
2026-06-19,X / Twitter,@Hsynant7,@kepezbelediyesi Senelerdir Kepez WhatsApp hattına sikayette bulundum Kepez belediyesine gidip sikayet dilekçesi verdim hala bi sonuç yok parkın bakımı yapılıyor sulaması yapılıyor arabalar parkın içine girip park yapıyor kamu malına zarar veriliyor ve buna göz yumuluyor https://t.co/zD6qp6OsZC,Kepez Belediyesi + sikayet,neutral,4,4,0,1,0,0,https://x.com/Hsynant7/status/2067872956135452735,İçerik izlemeye alınmalı. Şu aşamada acil aksiyon gerekmiyor.,Otomatik X,8,Yüksek,Kepez Belediyesi / Kepez Belediye Başkanı sinyali • Başkan / belediye bağlamı • hizmet / şikayet / kriz bağlamı,Evet,Başkan karar aday
2026-06-19,X / Twitter,@Hsynant7,@kepezbelediyesi Senelerdir Kepez WhatsApp hattına sikayette bulundum Kepez belediyesine gidip sikayet dilekçesi verdim hala bi sonuç yok parkın bakımı yapılıyor sulaması yapılıyor arabalar parkın içine girip park yapıyor https://t.co/M4FtPO2snR,Kepez Belediyesi + sikayet,neutral,4,4,0,1,0,0,https://x.com/Hsynant7/status/2067872562701377847,İçerik izlemeye alınmalı. Şu aşamada acil aksiyon gerekmiyor.,Otomatik X,8,Yüksek,Kepez Belediyesi / Kepez Belediye Başkanı sinyali • Başkan / belediye bağlamı • hizmet / şikayet / kriz bağlamı,Evet,Başkan karar aday
2026-06-18,X / Twitter,@mesutkocagoztr,"Kepez’imizde çevreci bir hareketin öncüsü olmaktan dolayı gurur duyuyoruz.   “Temizlik Kirletmemektir” projemizi Göçerler, Çamlıbel, Erenköy, Esentepe, Fatih ve Kanal Mahallelerimizde başlattık. Mahallelerimizde başlattığımız genel temizlik, bakım, onarım ve bilinçlendirme https://t.co/GxCLi679Ou",Kepez + temizlik,neutral,4,2,65,1,15,0,https://x.com/mesutkocagoztr/status/2067676301041803345,İçerik izlemeye alınmalı. Şu aşamada acil aksiyon gerekmiyor.,Otomatik X,10,Yüksek,Mesut Kocagöz sinyali • Kepez sinyali • güçlü Kepez mahalle sinyali • hizmet / şikayet / kriz bağlamı,Evet,Başkan karar aday
2026-06-18,X / Twitter,@Antalya_haberim,"Kepez’de gönül belediyeciliği hayatlara dokunuyor  Kepez Belediye Başkanı Mesut Kocagöz, 1. sınıf öğrencisi doğuştan engelli Kerim Asaf’ın karne mutluluğunu tekerlekli sandalye ile taçlandırdı. Kepez Belediyesi’nin engelleri aşan ve gönülleri ısıtan yardım eli, 60 yaşındaki https://t.co/VmWRto7B3q",Mesut Kocagöz,neutral,4,2,0,0,0,0,https://x.com/Antalya_haberim/status/2067565642429919533,İçerik izlemeye alınmalı. Şu aşamada acil aksiyon gerekmiyor.,Otomatik X,10,Yüksek,Mesut Kocagöz sinyali • Kepez Belediyesi / Kepez Belediye Başkanı sinyali • Antalya sinyali • Başkan / belediye bağlamı • hizmet / şikayet / kriz bağlamı,Evet,Başkan karar aday
