date,platform,account,content,topic,sentiment,risk_score,opportunity_score,likes,comments,shares,views,url,action_note,source_type
2026-05-12,X / Twitter,@fazlsafi,@ANTALYABB Antalya Kepez Demirel mahallesi 1964. Sokakta ASAT kanalizazyon çalışması yaptı. Ama aylar olmasına rağmen asfalt yapılmadı.Bununla birlikte toprak bile kepçe ile Düzeltilmedi evimizin sokağına girmekte zorluk çekiyoruz bilginize...,Kepez + asfalt,neutral,4,2,0,1,0,0,https://x.com/fazlsafi/status/2054281197585309868,İçerik izlemeye alınmalı. Şu aşamada acil aksiyon gerekmiyor.,Otomatik X
2026-05-12,X / Twitter,@hibyanewsagency,"Kepez’de yeşil alanlarda bakım ve düzenleme çalışmaları sürüyor: Antalya- Kepez Belediyesi Park ve Bahçeler Müdürlüğü ekipleri, ilçe genelinde yürüttükleri çim biçme, ağaç budama ve çevre düzenleme çalışmalarıyla yeşil alanların bakımını sürdürüyor. https://t.co/rLcEAIgoX4 https://t.co/isu4CbRWZT",Kepez Belediyesi + park,neutral,4,4,0,0,0,0,https://x.com/hibyanewsagency/status/2054153959259218072,İçerik izlemeye alınmalı. Şu aşamada acil aksiyon gerekmiyor.,Otomatik X
2026-05-12,X / Twitter,@_acil_ali_,Yer: Antalya Kepez Ayanoğlu mahallesi. Bu park ve çevresinde oturma bankları da var üzeri kapalı. Bu bölgeyi hergün @kepezbelediyesi çalışanı tertemiz ediyor. 365 günün yaklaşık 300 günü böyle. Bunları yapanlara ne demeli?🤬🤬 https://t.co/a05Ct3dxfk,Kepez + park,neutral,2,4,4,0,1,0,https://x.com/_acil_ali_/status/2054122461575147838,İçerik izlemeye alınmalı. Şu aşamada acil aksiyon gerekmiyor.,Otomatik X
2026-05-08,X / Twitter,@newsfromworld06,Engin Yılmaz / “Sıra Kepez Belediyesinde mi?” Sorusu Neyi İfade Ediyor? https://t.co/evkTqeZBxJ #kepezbelediyesi #mesutkocagöz #antalyabelediye #belediye #tutuklamalar #soruşturma #yargı #antalyabüyükşehirbelediyesi #rüşvet #siyaset #gündem https://t.co/7Yx06uQcHA,Kepez Belediyesi + soruşturma,neutral,4,2,0,0,0,0,https://x.com/newsfromworld06/status/2052861595928203648,İçerik izlemeye alınmalı. Şu aşamada acil aksiyon gerekmiyor.,Otomatik X
2026-05-08,X / Twitter,@HO_17gs_,@ZamHaberAjans Helal olsun Yusuf agama geçen hafta Çanakkale Kepez şubesine gittim mükemmel fiyatlar uygun temiz lezzetli 👏👏👏 çalışanlarda temizlikten şikayet ediyor beğenmeyen pis işte çalışsın,Kepez + şikayet,negative,6,2,0,0,0,0,https://x.com/HO_17gs_/status/2052789149107736647,"X üzerinde riskli paylaşım tespit edildi. Yayılım, yorum tonu ve yerel basına sıçrama ihtimali izlenmeli.",Otomatik X
