date,platform,account,content,topic,sentiment,risk_score,opportunity_score,likes,comments,shares,views,url,action_note,source_type
2026-05-15,X / Twitter,@servicesgrouptr,"Bugün Kepez bölgesinde gerçekleştirilen merkezi ısıtma sistemi bakım çalışmalarımızdan bir kare.  3 adet kazan cihazında periyodik bakım, iç temizlik ve sistem kontrol işlemleri saha uygulaması kapsamında tamamlanmıştır. Isıtma verimliliğinin korunması ve sistem performansının https://t.co/hmyNibYDTS",Kepez + temizlik,negative,7,2,0,0,0,0,https://x.com/servicesgrouptr/status/2055309211601436810,"X üzerinde riskli paylaşım tespit edildi. Yayılım, yorum tonu ve yerel basına sıçrama ihtimali izlenmeli.",Otomatik X
2026-05-15,X / Twitter,@HaberQcom,"Antalya’nın Kepez ilçesinde apartman sakinlerinden gelen şikayetler üzerine bir çöp eve operasyon düzenlendi.  Belediye ekipleri, zabıta ve polis eşliğinde evde biriken atıkları tahliye ederek kapsamlı temizlik çalışması yaptı.  #Çöpev https://t.co/CUXy8a7Koy",Kepez + şikayet,negative,8,2,0,0,0,0,https://x.com/HaberQcom/status/2055241404947812751,"X üzerinde riskli paylaşım tespit edildi. Yayılım, yorum tonu ve yerel basına sıçrama ihtimali izlenmeli.",Otomatik X
2026-05-15,X / Twitter,@Antalya_haberim,"KEPEZ’DE ÇÖP EV OPERASYONU  Kepez Belediyesi, Düdenbaşı Mahallesi 2324 Sokak’ta apartman sakinlerinden gelen şikayetler üzerine çöp eve müdahale etti. Temizlik İşleri Müdürlüğü ekipleri, Zabıta Müdürlüğü ve kolluk kuvvetleriyle koordineli şekilde yürüttüğü çalışma kapsamında evde https://t.co/bVANHcwjKw",Kepez Belediyesi + şikayet,negative,8,2,0,0,0,0,https://x.com/Antalya_haberim/status/2055230868973646123,"X üzerinde riskli paylaşım tespit edildi. Yayılım, yorum tonu ve yerel basına sıçrama ihtimali izlenmeli.",Otomatik X
2026-05-15,X / Twitter,@alanyabasincom,"Kepez’de Çöp Ev Temizliği: Mahalle Rahat Nefes Aldı Kepez’de apartman sakinlerinin şikayet ettiği çöp ev belediye ekiplerince temizlendi, kötü koku ve sağlık riski ortadan kaldırıldı. https://t.co/PKNfLYJxSP #Kepez #ÇöpEv #belediye #alanyabasın #alanyahaber #alanyahaberleri",Kepez + şikayet,negative,6,2,0,0,0,0,https://x.com/alanyabasincom/status/2055224803460616628,"X üzerinde riskli paylaşım tespit edildi. Yayılım, yorum tonu ve yerel basına sıçrama ihtimali izlenmeli.",Otomatik X
2026-05-12,X / Twitter,@fazlsafi,@ANTALYABB Antalya Kepez Demirel mahallesi 1964. Sokakta ASAT kanalizazyon çalışması yaptı. Ama aylar olmasına rağmen asfalt yapılmadı.Bununla birlikte toprak bile kepçe ile Düzeltilmedi evimizin sokağına girmekte zorluk çekiyoruz bilginize...,Kepez + asfalt,neutral,4,2,0,1,0,0,https://x.com/fazlsafi/status/2054281197585309868,İçerik izlemeye alınmalı. Şu aşamada acil aksiyon gerekmiyor.,Otomatik X
2026-05-12,X / Twitter,@hibyanewsagency,"Kepez’de yeşil alanlarda bakım ve düzenleme çalışmaları sürüyor: Antalya- Kepez Belediyesi Park ve Bahçeler Müdürlüğü ekipleri, ilçe genelinde yürüttükleri çim biçme, ağaç budama ve çevre düzenleme çalışmalarıyla yeşil alanların bakımını sürdürüyor. https://t.co/rLcEAIgoX4 https://t.co/isu4CbRWZT",Kepez Belediyesi + park,neutral,4,4,0,0,0,0,https://x.com/hibyanewsagency/status/2054153959259218072,İçerik izlemeye alınmalı. Şu aşamada acil aksiyon gerekmiyor.,Otomatik X
2026-05-12,X / Twitter,@_acil_ali_,Yer: Antalya Kepez Ayanoğlu mahallesi. Bu park ve çevresinde oturma bankları da var üzeri kapalı. Bu bölgeyi hergün @kepezbelediyesi çalışanı tertemiz ediyor. 365 günün yaklaşık 300 günü böyle. Bunları yapanlara ne demeli?🤬🤬 https://t.co/a05Ct3dxfk,Kepez + park,neutral,2,4,4,0,1,0,https://x.com/_acil_ali_/status/2054122461575147838,İçerik izlemeye alınmalı. Şu aşamada acil aksiyon gerekmiyor.,Otomatik X
