date,platform,account,content,topic,sentiment,risk_score,opportunity_score,likes,comments,shares,views,url,action_note,source_type,local_relevance_score,local_relevance_level,local_relevance_reason,president_decision_candidate,control_decision
2026-06-18,X / Twitter,@mesutkocagoztr,"Kepez’imizde çevreci bir hareketin öncüsü olmaktan dolayı gurur duyuyoruz.   “Temizlik Kirletmemektir” projemizi Göçerler, Çamlıbel, Erenköy, Esentepe, Fatih ve Kanal Mahallelerimizde başlattık. Mahallelerimizde başlattığımız genel temizlik, bakım, onarım ve bilinçlendirme https://t.co/GxCLi679Ou",Kepez + temizlik,neutral,4,2,4,0,2,0,https://x.com/mesutkocagoztr/status/2067676301041803345,İçerik izlemeye alınmalı. Şu aşamada acil aksiyon gerekmiyor.,Otomatik X,10,Yüksek,Mesut Kocagöz sinyali • Kepez sinyali • güçlü Kepez mahalle sinyali • hizmet / şikayet / kriz bağlamı,Evet,Başkan karar aday
2026-06-18,X / Twitter,@Antalya_haberim,"Kepez’de gönül belediyeciliği hayatlara dokunuyor  Kepez Belediye Başkanı Mesut Kocagöz, 1. sınıf öğrencisi doğuştan engelli Kerim Asaf’ın karne mutluluğunu tekerlekli sandalye ile taçlandırdı. Kepez Belediyesi’nin engelleri aşan ve gönülleri ısıtan yardım eli, 60 yaşındaki https://t.co/VmWRto7B3q",Mesut Kocagöz,neutral,4,2,0,0,0,0,https://x.com/Antalya_haberim/status/2067565642429919533,İçerik izlemeye alınmalı. Şu aşamada acil aksiyon gerekmiyor.,Otomatik X,10,Yüksek,Mesut Kocagöz sinyali • Kepez Belediyesi / Kepez Belediye Başkanı sinyali • Antalya sinyali • Başkan / belediye bağlamı • hizmet / şikayet / kriz bağlamı,Evet,Başkan karar aday
2026-06-18,X / Twitter,@ODemirhan5302,"@kepezocak Kepez Ülkü Ocakları Başkanımız Mehmet Köktaş’a, İl Başkanımız Ömer Faruk Yıldırım’a ve her aşamasında emek veren tüm dava arkadaşlarımıza Sahada gece gündüz demeden çalışan, tüm dava arkadaşlarımıza ve reislerimize teşekkür ederiz varolsun Ülkü Ocakları 🤘🇹🇷",Kepez + dava,neutral,4,4,1,0,0,0,https://x.com/ODemirhan5302/status/2067540239061602404,İçerik izlemeye alınmalı. Şu aşamada acil aksiyon gerekmiyor.,Otomatik X,7,Orta,Kepez sinyali • Başkan / belediye bağlamı • genel/zayıf mahalle sinyali • hizmet / şikayet / kriz bağlamı,Hayır,Ekip kontrolü
2026-06-17,X / Twitter,@KonyaaltAk,"Genel Başkan Yardımcımız, Siyasi ve Hukuki İşler Başkanımız Sayın Hayati Yazıcı’nın katılımlarıyla gerçekleştireceğimiz Genişletilmiş İl Danışma Meclisimize tüm dava arkadaşlarımızı bekliyoruz. 📅 19 Haziran 2026 Cuma 🕣 14.30 📍Erdem Beyazıt Kültür Merkezi Kepez/Antalya https://t.co/B2DQ7piIuE",Kepez + dava,neutral,4,2,6,0,3,0,https://x.com/KonyaaltAk/status/2067284569783492610,İçerik izlemeye alınmalı. Şu aşamada acil aksiyon gerekmiyor.,Otomatik X,10,Yüksek,Kepez sinyali • Antalya + Kepez birlikte • Başkan / belediye bağlamı • genel/zayıf mahalle sinyali • hizmet / şikayet / kriz bağlamı,Evet,Başkan karar aday
2026-06-17,X / Twitter,@AntalyaPartner_,Kepez Temizlik yapıyorum https://t.co/bRXJQVVUgn,Kepez + temizlik,neutral,4,2,10,1,0,0,https://x.com/AntalyaPartner_/status/2067279099874164914,İçerik izlemeye alınmalı. Şu aşamada acil aksiyon gerekmiyor.,Otomatik X,6,Orta,Kepez sinyali • Antalya sinyali • hizmet / şikayet / kriz bağlamı,Hayır,Ekip kontrolü
2026-06-17,X / Twitter,@Mustafa71524561,@kepezocak Ülkü Ocakları Kepez ilçe başkanı Mehmet köktaş başkanımızın öncülüğünde ve teşkilat mensuplarımızla beraber gerçekleştirdiğimiz Türkiye de bir ilke imza attığımız festivalimize emeği geçen herkese ve dava arkadaşlarıma teşekkür ediyorum Var Olsun Ülkü Ocakları 🇹🇷🤘,Kepez + dava,neutral,4,4,2,0,0,0,https://x.com/Mustafa71524561/status/2067157422662156721,İçerik izlemeye alınmalı. Şu aşamada acil aksiyon gerekmiyor.,Otomatik X,6,Orta,Kepez sinyali • Başkan / belediye bağlamı • hizmet / şikayet / kriz bağlamı,Hayır,Ekip kontrolü
