date,platform,account,content,topic,sentiment,risk_score,opportunity_score,likes,comments,shares,views,url,action_note,source_type,local_relevance_score,local_relevance_level,local_relevance_reason,president_decision_candidate,control_decision
2026-06-29,X / Twitter,@DrHalefYilmaz,"Antalya Elmalı İlçe kongremiz bugün gerçekleştirildi. Böylece Antalya'da ilçe kongrelerimiz hayırlısıyla tamamlanmış oldu.   Kongrelerimiz neticesinde göreve seçilen; Aksu İlçe Başkanı Kemal Güler, Kepez İlçe Başkanı İsmail Kaya, Manavgat İlçe Başkanı Hüseyin Kısa, Muratpaşa İlçe https://t.co/vuaZE0BTw1",Kepez,neutral,4,2,95,4,28,0,https://x.com/DrHalefYilmaz/status/2071649497466159447,İçerik izlemeye alınmalı. Şu aşamada acil aksiyon gerekmiyor.,Otomatik X,7,Orta,Kepez sinyali • Antalya sinyali • Başkan / belediye bağlamı • hizmet / şikayet / kriz bağlamı,Hayır,Ekip kontrolü
2026-06-29,X / Twitter,@mesutkocagoztr,"Antalya’nın Geleceği Kepez’de 7 Gün Nasıl Geçti? 🔎  📌 Başkan Mesut Kocagöz, altı mahallede düzenlenen ""Söz Vatandaşta"" buluşmalarında vatandaşlarla bir araya geldi. 📌 ""Temizlik Kirletmemektir"" kampanyasıyla çevre temizliği ve farkındalık çalışmaları sürdürüldü. 📌 Başkan Mesut https://t.co/qJHC1pttxD",Mesut Kocagöz + temizlik,neutral,4,2,54,0,17,0,https://x.com/mesutkocagoztr/status/2071642532149187060,İçerik izlemeye alınmalı. Şu aşamada acil aksiyon gerekmiyor.,Otomatik X,10,Yüksek,Mesut Kocagöz sinyali • Kepez sinyali • Antalya sinyali • Başkan / belediye bağlamı • genel/zayıf mahalle sinyali • hizmet / şikayet / kriz bağlamı,Evet,Başkan karar aday
2026-06-29,X / Twitter,@kepezbelediyesi,"Antalya’nın Geleceği Kepez’de 7 Gün Nasıl Geçti? 🔎  📌 Başkan Mesut Kocagöz, altı mahallede düzenlenen ""Söz Vatandaşta"" buluşmalarında vatandaşlarla bir araya geldi. 📌 ""Temizlik Kirletmemektir"" kampanyasıyla çevre temizliği ve farkındalık çalışmaları sürdürüldü. 📌 Başkan Mesut https://t.co/aoEnTokEUl",Mesut Kocagöz + temizlik,neutral,4,2,21,0,3,0,https://x.com/kepezbelediyesi/status/2071642264347037743,İçerik izlemeye alınmalı. Şu aşamada acil aksiyon gerekmiyor.,Otomatik X,10,Yüksek,Mesut Kocagöz sinyali • Kepez sinyali • Antalya sinyali • Başkan / belediye bağlamı • genel/zayıf mahalle sinyali • hizmet / şikayet / kriz bağlamı,Evet,Başkan karar aday
2026-06-29,X / Twitter,@antalyakent,"Kepez Belediyesi, Fidan Caddesi’nde asfalt yenileme çalışması başlattı  https://t.co/gZQ89HAAN5 https://t.co/OeL0T5TLBh",Kepez Belediyesi + asfalt,neutral,4,2,0,0,0,0,https://x.com/antalyakent/status/2071508439256236184,İçerik izlemeye alınmalı. Şu aşamada acil aksiyon gerekmiyor.,Otomatik X,9,Yüksek,Kepez Belediyesi / Kepez Belediye Başkanı sinyali • Antalya sinyali • Başkan / belediye bağlamı • hizmet / şikayet / kriz bağlamı,Evet,Başkan karar aday
2026-06-28,X / Twitter,@tadeo_mphepo,arkadaş kitap rüzgar küçük kahve sevmek klavye gece aile park kedi @乂esCort乂@ sonra antalya kepez çorap https://t.co/jlYLby1f8P,Kepez + park,neutral,2,4,0,0,0,0,https://x.com/tadeo_mphepo/status/2071360354945208449,İçerik izlemeye alınmalı. Şu aşamada acil aksiyon gerekmiyor.,Otomatik X,8,Yüksek,Kepez sinyali • Antalya + Kepez birlikte • hizmet / şikayet / kriz bağlamı,Evet,Başkan karar aday
2026-06-28,X / Twitter,@kepezbelediyesi,"Kirişçiler Mahallemize yeni bir yaşam alanı kazandırıyoruz.   Kepez Belediyesi olarak mahallelerimizin ihtiyaçlarına yönelik çalışmalarımızı sürdürüyor; çocuklarımızın, ailelerimizin ve hemşehrilerimizin keyifle vakit geçirebileceği yeni alanlar oluşturuyoruz.  Kirişçiler https://t.co/QRpGp5WI2d",Kepez Belediyesi,negative,7,2,29,1,3,0,https://x.com/kepezbelediyesi/status/2071186860248825871,"X üzerinde riskli paylaşım tespit edildi. Yayılım, yorum tonu ve yerel basına sıçrama ihtimali izlenmeli.",Otomatik X,10,Yüksek,Kepez Belediyesi / Kepez Belediye Başkanı sinyali • Başkan / belediye bağlamı • güçlü Kepez mahalle sinyali • hizmet / şikayet / kriz bağlamı,Evet,Başkan karar aday
2026-06-27,X / Twitter,@kepezbelediyesi,"@Emrahalt26 @mesutkocagoztr Merhabalar Emrah Bey,  Sizinle iletişime geçilerek görüşme sağlanmış olup, talebiniz Temizlik İşleri Müdürlüğümüze iletilmiştir.  Çalışmaların tamamlanmasının ardından tarafınıza gerekli bilgilendirme yapılacaktır.  İyi günler dileriz.  KEPEZ İLETİŞİM MERKEZİ (KİM)",Kepez + temizlik,neutral,4,2,1,0,0,0,https://x.com/kepezbelediyesi/status/2070882764409221444,İçerik izlemeye alınmalı. Şu aşamada acil aksiyon gerekmiyor.,Otomatik X,10,Yüksek,Mesut Kocagöz sinyali • Kepez sinyali • Başkan / belediye bağlamı • hizmet / şikayet / kriz bağlamı,Evet,Başkan karar aday
